{
  "$schema": "http://json-schema.org/draft-07/schema#",
  "title": "Knowledge Graph",
  "description": "Persistent codebase memory for the Recursive Descent Analysis Agent v2.0. Stores file hashes, dependency maps, per-persona scores, and flags. Enables delta analysis on subsequent runs.",
  "type": "object",
  "required": ["version", "project", "last_session", "last_commit", "total_files", "files_analyzed_this_session", "files_inherited", "files", "modules"],
  "properties": {
    "version": {
      "type": "string",
      "description": "Schema version",
      "const": "2.0"
    },
    "project": {
      "type": "string",
      "description": "Project name from PROJECT-CONTEXT"
    },
    "last_session": {
      "type": "string",
      "format": "date",
      "description": "Date of the last analysis session"
    },
    "last_commit": {
      "type": "string",
      "description": "Git commit hash at time of last analysis, or 'no-git' if not a git repo"
    },
    "total_files": {
      "type": "integer",
      "description": "Total files tracked in the graph"
    },
    "files_analyzed_this_session": {
      "type": "integer",
      "description": "Files that were re-analyzed in the most recent session"
    },
    "files_inherited": {
      "type": "integer",
      "description": "Files that inherited prior scores (unchanged since last analysis)"
    },
    "files": {
      "type": "object",
      "description": "Map of file path → file analysis entry",
      "additionalProperties": {
        "$ref": "#/definitions/FileEntry"
      }
    },
    "modules": {
      "type": "object",
      "description": "Map of module name → module summary",
      "additionalProperties": {
        "$ref": "#/definitions/ModuleEntry"
      }
    }
  },
  "definitions": {
    "FileEntry": {
      "type": "object",
      "required": ["hash", "last_analyzed", "descent_level_reached", "module", "scores"],
      "properties": {
        "hash": {
          "type": "string",
          "description": "SHA-256 hash of file contents at time of last analysis"
        },
        "last_analyzed": {
          "type": "string",
          "format": "date",
          "description": "Date this file was last analyzed"
        },
        "descent_level_reached": {
          "type": "integer",
          "minimum": 0,
          "maximum": 3,
          "description": "Deepest descent level this file was analyzed at (0=app shell, 1=module, 2=component, 3=function)"
        },
        "module": {
          "type": "string",
          "description": "Module this file belongs to"
        },
        "line_count": {
          "type": "integer",
          "description": "Number of lines in the file"
        },
        "dependencies": {
          "type": "array",
          "items": { "type": "string" },
          "description": "Files this file imports (resolved absolute paths)"
        },
        "dependents": {
          "type": "array",
          "items": { "type": "string" },
          "description": "Files that import this file"
        },
        "scores": {
          "$ref": "#/definitions/Scores"
        },
        "flags": {
          "$ref": "#/definitions/PersonaFlags"
        },
        "cross_persona": {
          "type": "boolean",
          "description": "True if 2+ personas flagged this file"
        },
        "milestone_critical": {
          "type": "array",
          "items": { "type": "string" },
          "description": "Which milestones this file is on the critical path for (e.g., ['M1', 'M2'])"
        },
        "stale": {
          "type": "boolean",
          "description": "True if file changed since last analysis and needs re-descent. Set during delta diff, cleared after re-analysis."
        }
      }
    },
    "Scores": {
      "type": "object",
      "properties": {
        "completeness": { "type": "number", "minimum": 0, "maximum": 10 },
        "robustness": { "type": "number", "minimum": 0, "maximum": 10 },
        "quality": { "type": "number", "minimum": 0, "maximum": 10 },
        "security": { "type": "number", "minimum": 0, "maximum": 10 },
        "test_coverage": { "type": "number", "minimum": 0, "maximum": 10 }
      }
    },
    "PersonaFlags": {
      "type": "object",
      "properties": {
        "architect": {
          "type": "array",
          "items": { "type": "string" },
          "description": "Flags from the Architect persona (prefix: ARCH-NNN)"
        },
        "user": {
          "type": "array",
          "items": { "type": "string" },
          "description": "Flags from the User persona (prefix: USER-NNN)"
        },
        "adversary": {
          "type": "array",
          "items": { "type": "string" },
          "description": "Flags from the Adversary persona (prefix: ADV-NNN)"
        }
      }
    },
    "ModuleEntry": {
      "type": "object",
      "properties": {
        "files": {
          "type": "array",
          "items": { "type": "string" },
          "description": "All file paths belonging to this module"
        },
        "scores": {
          "$ref": "#/definitions/Scores"
        },
        "persona_scores": {
          "type": "object",
          "properties": {
            "architect": { "type": "number" },
            "user": { "type": "number" },
            "adversary": { "type": "number" }
          }
        },
        "milestone_relevance": {
          "type": "object",
          "additionalProperties": {
            "type": "string",
            "enum": ["critical", "relevant", "not-needed"]
          }
        },
        "last_full_descent": {
          "type": "string",
          "format": "date"
        },
        "drift_count": {
          "type": "integer",
          "description": "Number of documentation drift findings affecting this module"
        }
      }
    }
  }
}
